{
  "MSbar_same_scale_candidate": {
    "MTT_selected_physical_vacuum": false,
    "c_scheme": "3/2",
    "conventional_candidate_only": true,
    "ell": "-3/2",
    "fitted_coefficients_used": false,
    "global_minimum_in_open_neutral_chamber": false,
    "infimum_location": "t approaches -1 from above; singular wall not attained",
    "local_minimum_is_metastable": true,
    "log_series_terms": 32,
    "mu_over_h": "1",
    "observed_values_used": false,
    "outer_scans": [
      {
        "ambiguous_cells": 0,
        "cells": 512,
        "interval": [
          "-1023/1024",
          "-7/20"
        ],
        "minimum_absolute_margin": {
          "exact_rational_bounds_sha256": "bca8f473a012fb613a58a45c3a5d9fe428591fa98a83357466856e19941c125f",
          "lower_decimal": "0.123744960248385613213075",
          "upper_decimal": "0.123744960248385613213075"
        },
        "negative_cells": 512,
        "positive_cells": 0
      },
      {
        "ambiguous_cells": 0,
        "cells": 1024,
        "interval": [
          "-17/50",
          "27/100"
        ],
        "minimum_absolute_margin": {
          "exact_rational_bounds_sha256": "c19e09d43e1446cd2e70bf8296a0db55f54e559311924efc6da5018b736661d0",
          "lower_decimal": "0.058130981896033101998852",
          "upper_decimal": "0.058130981896033101998852"
        },
        "negative_cells": 0,
        "positive_cells": 1024
      },
      {
        "ambiguous_cells": 0,
        "cells": 512,
        "interval": [
          "29/100",
          "511/1024"
        ],
        "minimum_absolute_margin": {
          "exact_rational_bounds_sha256": "835a848153da991e03dfa7192b96edb13e79429edeb582bfafe3b666503b0944",
          "lower_decimal": "0.042732160054556543939550",
          "upper_decimal": "0.042732160054556543939550"
        },
        "negative_cells": 512,
        "positive_cells": 0
      }
    ],
    "proof_method": "exact rational interval logarithms from the atanh series with geometric remainder",
    "root_certificates": {
      "exact_root_count_in_neutral_chamber": 2,
      "left_wall_sign": "g<0 term by term on (-1,-1023/1024]",
      "local_maximum": {
        "box": [
          "-344776761/1000000000",
          "-8619419/25000000"
        ],
        "gprime_on_wide_box": {
          "exact_rational_bounds_sha256": "f0d18cc97fe080911a6329db88bfa3169b1d35ea0b5dc96e0682f5082340640f",
          "lower_decimal": "23.648257584329853006060426",
          "upper_decimal": "25.227687561673762733912124"
        },
        "left_g": {
          "exact_rational_bounds_sha256": "06d306de3c623a4e2efe6e8e6613a0c6b7bfbab06c039e2da3ced8edd1c06447",
          "lower_decimal": "-0.000000004214105763140481",
          "upper_decimal": "-0.000000004214105763140481"
        },
        "right_g": {
          "exact_rational_bounds_sha256": "e4746f0e28abf01ef2fccfdb3399fd26fdc1f984fbda6fb3d2b8452ac31c5f54",
          "lower_decimal": "0.000000020186132023922437",
          "upper_decimal": "0.000000020186132023922437"
        }
      },
      "local_minimum": {
        "box": [
          "140642141/500000000",
          "281284283/1000000000"
        ],
        "gprime_on_wide_box": {
          "exact_rational_bounds_sha256": "4f426ab3323f1ee8bde1b92b028eadb448c6daae6642178a2469ea9f50bdd855",
          "lower_decimal": "-6.179731244244871229902398",
          "upper_decimal": "-4.570685708492254040658682"
        },
        "left_g": {
          "exact_rational_bounds_sha256": "7fb508bfc27e09b7627707a0a6113672404a2358920ac69ce2164bd903624609",
          "lower_decimal": "0.000000004211790352060908",
          "upper_decimal": "0.000000004211790352060908"
        },
        "right_g": {
          "exact_rational_bounds_sha256": "f09546289ad6a00a095a72400ee15791ca7c2973bbd55d3e0bfeb91069b66125",
          "lower_decimal": "-0.000000001091107451290620",
          "upper_decimal": "-0.000000001091107451290620"
        }
      },
      "right_wall_g_limit": {
        "exact_rational_bounds_sha256": "c1b81c19cb542b85a68894ea3de27eabb1f948231bcc95c76922365b1becbaa2",
        "lower_decimal": "-0.339823725129904094294103",
        "upper_decimal": "-0.339823725129904094294103"
      },
      "right_wall_gprime": {
        "exact_rational_bounds_sha256": "5779561369377dc9f0a55d211f65242738a45545e838ce5004b5ed843e66ea44",
        "lower_decimal": "1.915452159387566694105841",
        "upper_decimal": "1.936985018817193816736840"
      }
    },
    "scheme": "MSbar",
    "stationary_equation": "g(t)=sum_a r_a^3 r_a'[log(r_a^2)-1]=0",
    "stationary_points": {
      "local_maximum": {
        "V": "2.358663442969574016140196929089211869",
        "V_second_derivative": "-32.533650448206879938951774561161008247",
        "branch_factors": {
          "-2": "1.344776760827292430950849481226950543",
          "-4": "1.689553521654584861901698962453901085",
          "2": "0.655223239172707569049150518773049457"
        },
        "branch_ratios": {
          "r_+2_over_r_-2": "0.487235694621627136685198862928432884",
          "r_+2_over_r_-4": "0.387808513181071336422148023935793040",
          "r_-2_over_r_-4": "0.795936171060357112140716007978597680"
        },
        "certified_interval": [
          "-344776761/1000000000",
          "-8619419/25000000"
        ],
        "decimal": "-0.344776760827292430950849481226950542708125474286",
        "type": "local maximum"
      },
      "local_minimum": {
        "V": "1.132876443911305656927258276004973657",
        "V_second_derivative": "7.070530392842679766013206861503160311",
        "branch_factors": {
          "-2": "0.718715717205756832240365781106113936",
          "-4": "0.437431434411513664480731562212227872",
          "2": "1.281284282794243167759634218893886064"
        },
        "branch_ratios": {
          "r_+2_over_r_-2": "1.782741426298086562062574742302111190",
          "r_+2_over_r_-4": "2.929108843121856793820726338431829983",
          "r_-2_over_r_-4": "1.643036281040618931273575446143943328"
        },
        "certified_interval": [
          "140642141/500000000",
          "281284283/1000000000"
        ],
        "decimal": "0.281284282794243167759634218893886064103754667776",
        "type": "local minimum"
      }
    },
    "wall_and_stationary_values": {
      "V_left_wall_limit": "-18.218633514050673302460385422703604777",
      "V_local_maximum": "2.358663442969574016140196929089211869",
      "V_local_minimum": "1.132876443911305656927258276004973657",
      "V_right_wall_limit": "1.222936392658276265383257073701912354",
      "left_wall_exact_interval": {
        "exact_rational_bounds_sha256": "7837791ee9f50791057bbd8b113837b21040c431a754302c2fdde674001bcb32",
        "lower_decimal": "-18.218633514050673302460385",
        "upper_decimal": "-18.218633514050673302460385"
      },
      "local_maximum_exact_interval": {
        "exact_rational_bounds_sha256": "477634686f48aec17ff8b55d998468afd95c001048d7f82e768a53080136dbaa",
        "lower_decimal": "2.358663434037906165475696",
        "upper_decimal": "2.358663451901241891602554"
      },
      "local_minimum_exact_interval": {
        "exact_rational_bounds_sha256": "5a2d12452c76c1670585f2e66ea29afd3e06a810caf45e40ea1b31c0258a095a",
        "lower_decimal": "1.132876440735586459845232",
        "upper_decimal": "1.132876447087024864185415"
      },
      "right_wall_exact_interval": {
        "exact_rational_bounds_sha256": "c47692359dd3162835ea115765cb4edb829a89a0a21361ab9b8af739279c6a30",
        "lower_decimal": "1.222936392658276265383257",
        "upper_decimal": "1.222936392658276265383257"
      }
    }
  },
  "T30_coordinate_scheme_diagnostic": {
    "MSbar_mu_over_h_decimal": "1.093610129104097356532400918517551308035252969181",
    "MSbar_mu_over_h_expression": "exp[-(ell_*+3/2)/2]",
    "coordinate": "(1-sqrt(13))/6",
    "coordinate_decimal": "-0.434258545910664882186536877911749324375216095641",
    "independently_selected": false,
    "role": "diagnostic scale required to preserve the finite T30 coordinate, not a derivation",
    "stationary_ell_decimal": "-1.678968537100247435314745381817178201037696806993",
    "stationary_ell_expression": "-1/2-A(t_*)/B(t_*)",
    "stationary_ell_rational_enclosure": {
      "exact_rational_bounds_sha256": "6c810cd4aebe9e81e2ead00906a9a744ff5b7294c0ce0337622a6d8931e9c979",
      "lower_decimal": "-1.678968537100247435314745381817178214",
      "upper_decimal": "-1.678968537100247435314745381817174738"
    }
  },
  "authority_reconciliation": {
    "A18": "full Lorentzian and constructive four-dimensional QFT remains open",
    "A73": "same-action determinant identity is respected without importing physical routing or counterterm selection",
    "A84": "proper-time gauge tier supplies no proven intertwiner to this scalar source coordinate",
    "A85": "profile-tier scheme agreement supplies neither scalar subtraction, Wick class nor mu/h",
    "B_ACTION_01": "advanced by an exact conditional shape and obstruction classification, but remains open",
    "B_QFT_02": "global Wick, external measure and finite renormalization selection remain open",
    "B_SM_02": "no physical mass or held-out Standard Model row is accepted",
    "CBF_T30": "finite chiral determinant and neutral chamber remain exact; its zero-mode coordinate is not promoted to the 4D vacuum",
    "QM_orbitwise_measure": "7/7 finite orbitwise Berezin measure does not close its own 0/4 full-domain contract"
  },
  "check_summary": {
    "failed": [],
    "passed": 70,
    "total": 70
  },
  "checks": {
    "A_is_nonzero_at_B_root_box": true,
    "B_derivative_has_negative_discriminant": true,
    "B_derivative_leading_coefficient_is_positive": true,
    "B_has_one_real_root_in_certified_box": true,
    "B_polynomial_is_derived_exactly": true,
    "Q4_polynomial_is_derived_exactly": true,
    "T30_coordinate_ell_is_enclosed": true,
    "T30_coordinate_is_in_neutral_chamber": true,